{
  "_id": {
    "$oid": "634418bd8877bcc3cc229857"
  },
  "run_id": "eaddb2d09f754a32a53ee6930ba8a7b3",
  "artifacts": [
    "model/MLmodel",
    "model/conda.yaml",
    "model/model.pkl",
    "model/python_env.yaml",
    "model/requirements.txt"
  ],
  "params": {
    "bootstrap": "True",
    "max_depth": "None",
    "max_samples": "None",
    "min_weight_fraction_leaf": "0.0",
    "max_leaf_nodes": "None",
    "class_weight": "None",
    "min_samples_leaf": "1",
    "random_state": "None",
    "min_impurity_decrease": "0.0",
    "verbose": "0",
    "n_estimators": "100",
    "criterion": "gini",
    "oob_score": "False",
    "ccp_alpha": "0.0",
    "warm_start": "False",
    "max_features": "sqrt",
    "n_jobs": "None",
    "min_samples_split": "2"
  },
  "metrics": {
    "training_score": {
      "$numberDouble": "0.9803370786516854"
    },
    "training_accuracy_score": {
      "$numberDouble": "0.9803370786516854"
    },
    "training_precision_score": {
      "$numberDouble": "0.9803467902611981"
    },
    "training_log_loss": {
      "$numberDouble": "0.12479794969312225"
    },
    "training_f1_score": {
      "$numberDouble": "0.9803091088695799"
    },
    "training_recall_score": {
      "$numberDouble": "0.9803370786516854"
    },
    "training_roc_auc_score": {
      "$numberDouble": "0.9976595158827505"
    }
  },
  "tags": {
    "estimator_class": "sklearn.ensemble._forest.RandomForestClassifier",
    "estimator_name": "RandomForestClassifier"
  }

}
